{
  "candidat_id": "mikolajczak-antoine",
  "_statut": "POC — vague 3 du codage (4 octobre 2026) : première recherche pour ce candidat, sur les 206 questions actives. Double codage aveugle (Opus 5.5, Sonnet 5.5), désaccords arbitrés provisoirement par un 3e modèle (Fable 5.1), contrôle humain de 10 % à faire. Aucun programme 2027 complet publié à cette date. À revoir avant publication.",
  "grille_version": "1.2",
  "programme": {
    "officiel_disponible": false,
    "date_publication": null,
    "url": null,
    "note": "Aucun programme officiel 2027 complet trouvé au 4 octobre 2026."
  },
  "positions": [
    {
      "question_id": "DEF-001",
      "code": null,
      "nature": "non_connu",
      "statut": "sans_extrait",
      "extraits": [],
      "codage": null,
      "arbitrage": null,
      "controle_humain": {
        "tire_au_sort": false
      },
      "contestations": [],
      "version": 1
    },
    {
      "question_id": "DEF-002",
      "code": null,
      "nature": "non_connu",
      "statut": "sans_extrait",
      "extraits": [],
      "codage": null,
      "arbitrage": null,
      "controle_humain": {
        "tire_au_sort": false
      },
      "contestations": [],
      "version": 1
    },
    {
      "question_id": "DEF-003",
      "code": null,
      "nature": "non_connu",
      "statut": "sans_extrait",
      "extraits": [],
      "codage": null,
      "arbitrage": null,
      "controle_humain": {
        "tire_au_sort": false
      },
      "contestations": [],
      "version": 1
    },
    {
      "question_id": "DEF-004",
      "code": null,
      "nature": "non_connu",
      "statut": "sans_extrait",
      "extraits": [],
      "codage": null,
      "arbitrage": null,
      "controle_humain": {
        "tire_au_sort": false
      },
      "contestations": [],
      "version": 1
    },
    {
      "question_id": "DEF-005",
      "code": null,
      "nature": "non_connu",
      "statut": "sans_extrait",
      "extraits": [],
      "codage": null,
      "arbitrage": null,
      "controle_humain": {
        "tire_au_sort": false
      },
      "contestations": [],
      "version": 1
    },
    {
      "question_id": "DEF-006",
      "code": null,
      "nature": "non_connu",
      "statut": "sans_extrait",
      "extraits": [],
      "codage": null,
      "arbitrage": null,
      "controle_humain": {
        "tire_au_sort": false
      },
      "contestations": [],
      "version": 1
    },
    {
      "question_id": "DEF-007",
      "code": null,
      "nature": "non_connu",
      "statut": "sans_extrait",
      "extraits": [],
      "codage": null,
      "arbitrage": null,
      "controle_humain": {
        "tire_au_sort": false
      },
      "contestations": [],
      "version": 1
    },
    {
      "question_id": "DEF-008",
      "code": null,
      "nature": "non_connu",
      "statut": "sans_extrait",
      "extraits": [],
      "codage": null,
      "arbitrage": null,
      "controle_humain": {
        "tire_au_sort": false
      },
      "contestations": [],
      "version": 1
    },
    {
      "question_id": "DEF-009",
      "code": null,
      "nature": "non_connu",
      "statut": "sans_extrait",
      "extraits": [],
      "codage": null,
      "arbitrage": null,
      "controle_humain": {
        "tire_au_sort": false
      },
      "contestations": [],
      "version": 1
    },
    {
      "question_id": "DEF-010",
      "code": null,
      "nature": "non_connu",
      "statut": "sans_extrait",
      "extraits": [],
      "codage": null,
      "arbitrage": null,
      "controle_humain": {
        "tire_au_sort": false
      },
      "contestations": [],
      "version": 1
    },
    {
      "question_id": "DEF-011",
      "code": null,
      "nature": "non_connu",
      "statut": "sans_extrait",
      "extraits": [],
      "codage": null,
      "arbitrage": null,
      "controle_humain": {
        "tire_au_sort": false
      },
      "contestations": [],
      "version": 1
    },
    {
      "question_id": "DEF-012",
      "code": null,
      "nature": "non_connu",
      "statut": "sans_extrait",
      "extraits": [],
      "codage": null,
      "arbitrage": null,
      "controle_humain": {
        "tire_au_sort": false
      },
      "contestations": [],
      "version": 1
    },
    {
      "question_id": "DEF-013",
      "code": null,
      "nature": "non_connu",
      "statut": "sans_extrait",
      "extraits": [],
      "codage": null,
      "arbitrage": null,
      "controle_humain": {
        "tire_au_sort": false
      },
      "contestations": [],
      "version": 1
    },
    {
      "question_id": "DEF-014",
      "code": null,
      "nature": "non_connu",
      "statut": "sans_extrait",
      "extraits": [],
      "codage": null,
      "arbitrage": null,
      "controle_humain": {
        "tire_au_sort": false
      },
      "contestations": [],
      "version": 1
    },
    {
      "question_id": "ENV-001",
      "code": null,
      "nature": "non_connu",
      "statut": "sans_extrait",
      "extraits": [],
      "codage": null,
      "arbitrage": null,
      "controle_humain": {
        "tire_au_sort": false
      },
      "contestations": [],
      "version": 1
    },
    {
      "question_id": "ENV-002",
      "code": -2,
      "nature": "nette",
      "statut": "accord",
      "extraits": [
        {
          "reformulation": "Le parti porte par le candidat défend une hausse de la production électrique bas-carbone reposant sur les renouvelables, le nucléaire existant (dont la prolongation des centrales amorties est présentée comme un atout) et de nouveaux réacteurs ; il juge l'écologie et le nucléaire compatibles. Aucune échéance de sortie du nucléaire n'est évoquée.",
          "citation_courte": "nucléaire historique et nouveau nucléaire",
          "reformulation_anonymisee": "[PARTI] défend une hausse de la production électrique bas-carbone reposant sur les renouvelables, le nucléaire existant (dont la prolongation des centrales amorties est présentée comme un atout) et de nouveaux réacteurs ; [PARTI] juge l'écologie et le nucléaire compatibles. Aucune échéance de sortie du nucléaire n'est évoquée.",
          "citation_anonymisee": "nucléaire historique et nouveau nucléaire",
          "source": {
            "url": "https://parti-equinoxe.fr/sobriete-nucleaire-renouvelables/",
            "titre": "Sobriété, Nucléaire, Renouvelables (site du parti Équinoxe)",
            "date_publication": "2026-09-17",
            "type": "programme_parti"
          },
          "date_consultation": "2026-10-04",
          "citation_verifiee_mot_a_mot": true
        }
      ],
      "codage": {
        "codeur_1": {
          "modele": "claude-opus-5-5",
          "code": -2,
          "nature": "nette",
          "justification": "Défend le nucléaire existant et de nouveaux réacteurs.",
          "date": "2026-10-04",
          "aveugle": true
        },
        "codeur_2": {
          "modele": "claude-sonnet-5-5",
          "code": -2,
          "nature": "nette",
          "justification": "Programme pro-nucléaire avec nouveaux réacteurs, pas de sortie.",
          "date": "2026-10-04",
          "aveugle": true
        },
        "accord": true
      },
      "arbitrage": null,
      "controle_humain": {
        "tire_au_sort": true,
        "date": null,
        "resultat": null
      },
      "contestations": [],
      "version": 1,
      "item_aveugle": "a12b0378"
    },
    {
      "question_id": "ENV-003",
      "code": null,
      "nature": "non_connu",
      "statut": "sans_extrait",
      "extraits": [],
      "codage": null,
      "arbitrage": null,
      "controle_humain": {
        "tire_au_sort": false
      },
      "contestations": [],
      "version": 1
    },
    {
      "question_id": "ENV-004",
      "code": null,
      "nature": "non_connu",
      "statut": "sans_extrait",
      "extraits": [],
      "codage": null,
      "arbitrage": null,
      "controle_humain": {
        "tire_au_sort": false
      },
      "contestations": [],
      "version": 1
    },
    {
      "question_id": "ENV-005",
      "code": null,
      "nature": "non_connu",
      "statut": "sans_extrait",
      "extraits": [],
      "codage": null,
      "arbitrage": null,
      "controle_humain": {
        "tire_au_sort": false
      },
      "contestations": [],
      "version": 1
    },
    {
      "question_id": "ENV-006",
      "code": null,
      "nature": "non_connu",
      "statut": "sans_extrait",
      "extraits": [],
      "codage": null,
      "arbitrage": null,
      "controle_humain": {
        "tire_au_sort": false
      },
      "contestations": [],
      "version": 1
    },
    {
      "question_id": "ENV-007",
      "code": null,
      "nature": "non_connu",
      "statut": "sans_extrait",
      "extraits": [],
      "codage": null,
      "arbitrage": null,
      "controle_humain": {
        "tire_au_sort": false
      },
      "contestations": [],
      "version": 1
    },
    {
      "question_id": "ENV-008",
      "code": null,
      "nature": "non_connu",
      "statut": "sans_extrait",
      "extraits": [],
      "codage": null,
      "arbitrage": null,
      "controle_humain": {
        "tire_au_sort": false
      },
      "contestations": [],
      "version": 1
    },
    {
      "question_id": "ENV-009",
      "code": null,
      "nature": "non_connu",
      "statut": "sans_extrait",
      "extraits": [],
      "codage": null,
      "arbitrage": null,
      "controle_humain": {
        "tire_au_sort": false
      },
      "contestations": [],
      "version": 1
    },
    {
      "question_id": "ENV-010",
      "code": null,
      "nature": "non_connu",
      "statut": "sans_extrait",
      "extraits": [],
      "codage": null,
      "arbitrage": null,
      "controle_humain": {
        "tire_au_sort": false
      },
      "contestations": [],
      "version": 1
    },
    {
      "question_id": "ENV-011",
      "code": null,